{
  "format": "fattail.labs.canonical_course",
  "model_version": "1.0",
  "exported_at": "2026-08-02T00:00:00Z",
  "source": {
    "kind": "authoring_spine",
    "label": "Draft outline — fill video_id + body_md before publish"
  },
  "course": {
    "id": "course",
    "slug": "fattail-labs-os",
    "title": "FatTail Labs: The Operating System",
    "subtitle": "Journey, Practice, Wiki, Strategy Lab, and Toughness — life routines, trained will, honest process",
    "description_md": "FatTail Labs is not a content dump. It is an **operating system for trader development**: tools and programs that turn daily work into durable habits and skills.\n\nThis course is the map. Each lesson starts with a short **intro video**, then **step-by-step directions** for the feature or surface you just saw.\n\n**The through-line is Journey.** Journey is not “another Practice app.” Every part of Labs you actually use — courses, live sessions, Practice (Trade Log, Journal, Retrospective, Reports), Wiki study, Strategy Lab work, and Toughness — shapes **Process Flow** — the flow state of your trading process. Practice is where the day-to-day trading loop lives; Journey is where that state stays honest and current.\n\n**Toughness is bigger than the sprints.** The Hard 20 / 40 / 75 programs are **training exercises** — deliberate challenge to develop mental toughness, associated with the **anterior mid-cingulate cortex (aMCC)**. The real program is the **life routines and habits** you construct around that training so follow-through becomes natural. **Trading routines are not separate from life** — they are routines you enable the same way you enable sleep, training, and review.\n\n**What you will be able to do**\n\n- Explain what Labs is for (capacity over dependency; process over P&L theater)\n- Use Journey as your path + process integrity surface\n- Run the Practice suite with shared context (account + date)\n- Treat Toughness as life-system design, with sprints as brain training — not as a streak contest\n- Navigate Wiki and Strategy Lab without getting lost\n- See how each surface feeds your Journey score\n\n*Spine status: outline only. Replace empty `video_id` values and flesh out each `body_md` before publish.*",
    "short_description": "Map of FatTail Labs: Journey, Practice, Wiki, Strategy Lab, and Toughness as life routines — intro video plus how-to for each surface.",
    "status": "draft",
    "version": "0.3.0-spine",
    "level": "beginner",
    "category_slugs": [],
    "instructor_refs": [
      {
        "id": "inst-1",
        "name": "Ernie Varitimos",
        "instructor_id": 1
      }
    ],
    "audience_category": "members",
    "pathway_position": null,
    "flagship": false,
    "trailer": null,
    "banner": null,
    "card_color": null,
    "certification_enabled": false,
    "estimated_duration_minutes": null,
    "learning_outcomes": [
      "State the purpose of FatTail Labs in one sentence: build solid trading habits and skills that lead to durable success",
      "Use Journey to see Process Flow (state of trading process) and learning path across the whole Lab",
      "Open Practice with the correct account and date context",
      "Log trades, journal a session, run a Retrospective, and read Reports as one loop",
      "Find doctrine and maps in the Wiki without treating it as a second course player",
      "Describe Strategy Lab’s Build / Test / Run roles and process gates",
      "Define Toughness as life routines and habits for durable success — not only Hard sprints",
      "Explain Hard 20/40/75 as aMCC-oriented training exercises that make surrounding routines natural",
      "Treat trading process (log, journal, retro) as life routines, not a separate box from the rest of life",
      "Know how Toughness feeds Journey when you engage it",
      "Never confuse process standing with profit claims or P&L ranking"
    ],
    "modules": [
      {
        "id": "mod-1",
        "title": "Overview: Why FatTail Labs Exists",
        "description_md": "One lesson. The thesis of the Lab: habits and skills first — stop the bleeding, capacity over dependency.",
        "order": 1,
        "kind": "standard",
        "lessons": [
          {
            "id": "les-1-1",
            "title": "FatTail Labs and Its Purpose",
            "slug": "fattail-labs-and-its-purpose",
            "order": 1,
            "kind": "video",
            "free_preview": true,
            "estimated_duration_minutes": 8,
            "content_blocks": [
              {
                "id": "blk-1",
                "type": "video_clip",
                "provider": "youtube",
                "video_id": "",
                "params": {},
                "duration_seconds": 0,
                "script_md": "TODO intro video — Labs purpose: trader development OS; habits & skills; process outcomes not profit claims; map of Journey / Practice / Wiki / Strategy Lab / Toughness; Toughness = life routines (sprints are aMCC training, not the whole program); trading routines are life routines; Journey as the scoreboard of use."
              },
              {
                "id": "blk-2",
                "type": "notes",
                "body_md": "## Outline (author me)\n\n### What this lesson is for\n- One-sentence purpose of FatTail Labs\n- Who this course is for (members starting the apps, not strategy depth)\n\n### The thesis\n- Capital preservation / “stop the bleeding” as first step for many\n- Sell the dream, sequence the discipline\n- **Capacity over dependency** — tools build *your* judgment\n- Marketing and self-talk: **process outcomes**, never profit claims\n- **Life is one system** — trading routines are routines you enable in your life, not a hermetically sealed “trader identity”\n\n### The map of the Lab (preview of later modules)\n| Surface | Job |\n|---------|-----|\n| **Journey** | Path + **Process Flow** (flow state of trading process) across *everything* you use |\n| **Practice** | Day-to-day trading loop: Trade Log → Journal → Retrospective → Reports |\n| **Wiki** | Growing map of what we teach |\n| **Strategy Lab** | Build / Test / Run strategies with process gates |\n| **Toughness** | Life routines & mental toughness; Hard sprints as **brain training** (aMCC); trading process as one set of life routines among others |\n\n### How this course works\n1. Short intro video\n2. Written directions for the feature\n3. Do the thing in the app — don’t only watch\n\n### Do this now\n- [ ] Open **Apps** from the main nav\n- [ ] Skim Journey, Practice, and Toughness without changing data yet\n- [ ] Note one life habit and one trading habit you want to make non-negotiable this month\n\n### What is *not* this course\n- Strategy mechanics (0DTE Foundations, Pure Options, Campaigns, …)\n- Broker setup deep dives\n- Live-session schedule (see calendar / live)\n\n---\n*Replace this outline with full member-facing copy when video is ready.*"
              }
            ],
            "resource_ids": []
          }
        ]
      },
      {
        "id": "mod-2",
        "title": "The Journey",
        "description_md": "Journey is the cross-Lab view of progress. Not a Practice app — the assessment surface that *everything you use* can contribute to.",
        "order": 2,
        "kind": "standard",
        "lessons": [
          {
            "id": "les-2-1",
            "title": "What Journey Is (and Is Not)",
            "slug": "what-journey-is",
            "order": 1,
            "kind": "video",
            "free_preview": false,
            "estimated_duration_minutes": 6,
            "content_blocks": [
              {
                "id": "blk-1",
                "type": "video_clip",
                "provider": "youtube",
                "video_id": "",
                "params": {},
                "duration_seconds": 0,
                "script_md": "TODO — Journey as path + Process Flow (state of being); not P&L leaderboard; not separate product; every Lab surface feeds Process Flow."
              },
              {
                "id": "blk-2",
                "type": "notes",
                "body_md": "## Outline (author me)\n\n### Open Journey\n- Path: **Apps → Journey** (or avatar menu)\n- URL: `/app/journey`\n\n### What you will see (high level)\n- **Process Flow** — the flow state of your trading process (a state of being, not a test score)\n- Learning path (courses, resume, quizzes)\n- Pathway & next live\n- Community board (opt-in)\n\n### Journey is not\n- A second login\n- A profit rank\n- A replacement for Trade Log or Journal\n\n### The core idea for this course\n**Every part of FatTail Labs you use shapes your Process Flow** — courses, live presence, Practice persistence, Wiki study, Strategy Lab work, and Toughness (life routines and, when you run them, Hard training blocks).\n\n### Do this now\n- [ ] Open Journey\n- [ ] Note which pillars look empty vs already active\n- [ ] Confirm you understand: empty is “not started,” not “failure” for new members\n\n---\n*Flesh out UI walkthrough screenshots after video. Product rename: Process Flow (DL-190); UI may still say Process Integrity until cutover.*"
              }
            ],
            "resource_ids": []
          },
          {
            "id": "les-2-2",
            "title": "Process Flow — The Flow State of Your Trading",
            "slug": "process-flow",
            "order": 2,
            "kind": "video",
            "free_preview": false,
            "estimated_duration_minutes": 10,
            "content_blocks": [
              {
                "id": "blk-1",
                "type": "video_clip",
                "provider": "youtube",
                "video_id": "",
                "params": {},
                "duration_seconds": 0,